Title,URL,Content,Date
nzebdesign.com淨零建築N次方,https://nzebdesign.com/,內政部建築研究所依據淨零建築推動策略，建立建築能效分級評估制度，將建築能效依節能成效分為7個等級，其中最高等級為近零碳建築(第1+級)，可達約50％的節能，並自111年1月1日實施。,"Dec 15, 2023 ·"
ws.moi.gov.tw › Download淨零建築及住宅節能推動措施 - Ministry of the ...,https://ws.moi.gov.tw/Download.ashx?u=LzAwMS9VcGxvYWQvNDA0L3JlbGZpbGUvOTI1OC80MjIwLzE0Y2Q5ZjAwLTYxNTgtNDRlMS1iMzM1LWUwZjhjNWUzMTcxYi5wZGY%3d&n=MDJAMTEzMOW7uuevieevgOiDveekvuacg%2ba6nemAmuacg%2bitsC3nsKHloLEt5L%2buMueJiC5wZGY%3d,強化建築節能法規. 能效評估:納管公有建築 容積獎勵納入能效評估. 節能法規:外殼節能基準 中央空調基準. 提升家電產品能效基準 3 家電設備. 預留充電設備停車位. 家電產品:分階段提高能效基準 節能家電減徵貨物稅. 充電設備:修正公寓大廈管理條例. 提升公有 ...,
ws.ndc.gov.tw › Download淨零建築路徑規劃及推動策略,https://ws.ndc.gov.tw/Download.ashx?u=LzAwMS9hZG1pbmlzdHJhdG9yLzEwL3JlbGZpbGUvMC8xNTI0NC9jZjE4Yjg3Ny03YzMyLTRjMmItYTQxOC04Zjc5OTY4ZmViN2YucGRm&n=MjAyM%2be2k%2ba%2fn%2birluihoV%2fmmKXlraPomZ9fMy0yLuWwiOmhjOWgseWwjl%2fmt6jpm7blu7rnr4not6%2flvpHopo%2flioPlj4rmjqjli5XnrZbnlaUucGRm&icon=.pdf,專家學者意見及國際發展經驗，於2021 年11月規劃完成淨零建築路徑藍圖，規劃先 建築節能50％，其餘用電再以再生能源碳中和至零碳排（圖1）。 淨零建築之推動路徑規劃由公有建築物帶頭做起，引導民間建築跟進，針對新建,
www.gvm.com.tw › article › 106989內政部建研所策動「淨零建築路徑規劃」實踐「2050年淨零排放」目標 | ...,https://www.gvm.com.tw/article/106989,內政部建築研究所表示，我國淨零建築的作法，是參考美日、歐盟等國際發展概念，先規劃建築節能50%，其餘用電再以再生能源碳中和至零碳排，以達到2050年淨零建築的願景。 臺灣 2050 淨零排放路徑規劃里程碑。 淨零建築規劃概念圖。,"Nov 9, 2023 ·"
www.abri.gov.tw › cp淨零建築路徑規劃 - 中華民國內政部建築研究所,https://www.abri.gov.tw/cp.aspx?n=15735,壹、建築部門減碳的挑戰. 為因應氣候變遷，行政院於110年1月成立「淨零排放路徑專案工作組」，責成各部會針對工業、能源、交通運輸、農業、環境及建築等部門規劃淨零路徑藍圖，內政部主責「淨零建築」路徑規劃及推動。. 我國建築數量及戶數均隨經濟 ...,